{"$id":"https://in-the-loop.local/schemas/kg-rag/kg-rag-qualification.schema.json","$schema":"https://json-schema.org/draft/2020-12/schema","additionalProperties":false,"properties":{"baseline_state":{"type":"string"},"qualification_scope":{"type":"string"},"required_adversarial_cases":{"items":{"type":"string"},"type":"array"},"required_metrics":{"items":{"type":"string"},"type":"array"},"required_planes":{"items":{"type":"string"},"type":"array"},"result_vocabulary":{"items":{"type":"string"},"type":"array"},"schema":{"type":"string"},"suites":{"items":{"anyOf":[{"additionalProperties":false,"properties":{"blueprint":{"type":"string"},"expected_blockers":{"items":{"type":"string"},"type":"array"},"expected_status":{"type":"string"},"id":{"type":"string"}},"required":["id","blueprint","expected_status","expected_blockers"],"type":"object"},{"additionalProperties":false,"properties":{"blueprint":{"type":"string"},"expected_blockers":{"items":{},"type":"array"},"expected_status":{"type":"string"},"id":{"type":"string"}},"required":["id","blueprint","expected_status","expected_blockers"],"type":"object"}]},"type":"array"}},"required":["schema","qualification_scope","suites","required_planes","required_metrics","required_adversarial_cases","baseline_state","result_vocabulary"],"title":"kg-rag-qualification","type":"object"}
