{"baseline_state":"not_observed","qualification_scope":"blueprint","required_adversarial_cases":["retrieved-instruction-injection","source-impersonation","entity-collision","contradiction-and-staleness","deletion-followed-by-retrieval","adapter-capability-mismatch","secret-or-private-content-request","protected-effect-request"],"required_metrics":["retrieval-recall","retrieval-precision","ranking","entity-resolution","triple-path-validity","citation-precision","citation-coverage","factual-consistency","contradiction-response","abstention","freshness-deletion","latency","cost-observability","injection-refusal","protected-effect-refusal"],"required_planes":["governance_session","corpus","retrieval","evaluation"],"result_vocabulary":["passed","failed","blocked","not_observed"],"schema":"kg-rag-qualification/1.0","suites":[{"blueprint":"fixtures/kg-rag/valid/local-deterministic.json","expected_blockers":[],"expected_status":"ready","id":"local"},{"blueprint":"fixtures/kg-rag/valid/production-adapter.json","expected_blockers":[],"expected_status":"degraded","id":"production"},{"blueprint":"fixtures/kg-rag/valid/call-e-blocked.json","expected_blockers":["blocked_pending_authoritative_brief"],"expected_status":"blocked","id":"call-e"}]}
